"排序","一级分类","二级分类","评估项目","操作描述","所需材料","适用年龄","是否必答","评分_a_分值","评分_a_标签","评分_a_说明","评分_b_分值","评分_b_标签","评分_b_说明","评分_c_分值","评分_c_标签","评分_c_说明","评分_d_分值","评分_d_标签","评分_d_说明","评分_e_分值","评分_e_标签","评分_e_说明"
"44","发展","认知表现","44：用八块塑料拼块摆出男孩的图像","把八块塑料拼块放在孩子面前的桌子上， 向他说明把这些塑料拼块摆放在一起摆 出一个男孩的图像。过了相当一段时间之 后，如果孩子仍难于理解这一项目，就用 所有拼块做示范。然后让孩子再试一次。 在项目结束时，如果孩子还没有用完所有 拼块，指着余下的拼块要他去完成。如果 孩子用一种独特的方式使用这些拼块中 的任何一块(例如把眼睛当作纽扣或者把 头发当成胡子等)要他做出解释。","八块塑料拼块 (脸、带胳膊的 躯体、两条腿、 头发、两只眼 睛、鼻子和嘴)","","是","2","P","孩子不需示范就能正确地摆出男孩的图像。","1","E","孩子能部分地摆出男孩的图像(如把眼睛放在脸上，或把 头和腿放在一起等)或者他需要示范来试着做或完成这项 任务。","0","F","孩子不能或者也不试图去摆出男孩图像(如把拼块堆起来， 任意地把拼块放到桌子上，弄得到处都是：或者完成的图 像一点也不像男孩等)。","","","","","",""
"45","发展","精细动作","45：用剪刀剪纸","示范给孩子看如何用剪刀剪纸，然后向他 说明照着去做。把纸和剪刀递给孩子。","一张纸、一把剪 刀","","是","2","P","孩子能用剪刀剪纸(如在纸上剪出一些小口或剪成狭长的 一条)。","1","E","孩子设法剪纸，虽未剪成，但似乎知道必要的动作。","0","F","孩子未能设法剪纸，而且似乎也不知道必要的动作；或者 他也不试着去做。","","","","","",""
"46","病理学","物品喜好","46：不适当地独自游戏","注意：非结构化游戏阶段是一个自由游戏 的阶段，时长大约2-5分钟，用来观察孩 子在没有指令的情况下是如何使用非结 构化时间的。向孩子说明除了那些还未使 用过的测试物品以外，他可以独自玩他想 要玩的任何东西。你坐在桌子旁，至少在 两分钟之内不要与孩子讲话或同他一起 玩。 注意观察孩子在非结构化游戏时间内是 如何独自一人玩的。","任何已使用过 的测试物品","","是","2","A","孩子能以适当的方式独自玩，合情合理地使用物品和空间。","1","M","孩子玩的方式有点不适当；或对玩一点兴趣也没有，","0","S","孩子以不适当的方式独自玩(如没有条理，错误使用物品， 用玩具从事不适当的活动，过度活跃或者退缩，易激惹， 沮丧，从事自我刺激的行为等)。","","","","","",""
"47","病理学","人际关系","47：不能与测试者进行互动","在非结构化游戏过程中注意孩子是否想 引起你的注意。他的意图可能是用语言表 达的(如“现在我该做什么?”或“你在 做什么?”),或非语言的(如看着你，拍 你的肩膀，设法要坐在你腿上等),你可 以对孩子进行互动的企图做出反应，但不 必拖延时间。","无","","是","2","A","孩子能使用语言或非语言手段与你进行任何类型的互动。","1","M","孩子似乎意识到你的存在，但没有进行互动。","0","S","孩子不与你进行任何类型的互动(如完全不理睬你，一般 说来其行动就好像没有意识到你的存在)。","","","","","",""
"48","病理学","人际关系","48：对测试者声音作不适当的反应","在非结构化游戏阶段结尾时实施此项目。 当孩子不看着你，也没有全神贯注于任何 活动时，喊他的名字，让他回到座位上。 注意孩子对你声音是如何反应的。","无","","是","2","A","孩子对你的声音能做出恰当的反应，以语言或非语言的方 式(如眨眼，转过头来说“好的”,返回座位等等)表明他 听见了你的声音。","1","M","孩子对你的声音做出不一致的反应。","0","S","孩子对你的声音做出不适当的反应，没有以任何语言的或 非语言的方式表明他已经听见你的声音。","","","","","",""
"49","发展","手眼协调","49A：搭起8块积木","把积木放在孩子面前的桌子上，向他示范 如何把积木一块压一块地搭起来。然后把 积木重新放回到桌子上，接下来向孩子说 明去照样做，并鼓励他搭起尽可能多的积 木，允许孩子试搭三次，其中一次至少 要搭起8块积木。","12块小积木， 放在一个盒子 里","","是","2","P","孩子在任何一次尝试中至少能搭起8块积木。","1","E","孩子至少能成功地搭起3块积木；或者他搭起3块以上的 积木，但积木倒塌了。","0","F","孩子不能或者也不试着去搭至少3块积木。","","","","","",""
"49","发展","手眼协调","49B：把积木放进盒子里","把一个小盒子放在桌子上积木块的旁边， 向孩子说明把积木放进盒子里。如果孩子 难于理解此项任务，可以用2块积木做示 范。然后再次向他说明把积木放回盒子 中 。","12块小积木， 放在一个盒子 里","","是","2","P","孩子至少能把其中一块积木放入盒中。","1","E","孩子未能设法把积木放入盒中(例如协调很差)。","0","F","孩子不试图完成这项任务。","","","","","",""
"49","发展","口语认知","49C：数出 2 块及 7 块积木","把2块积木放在孩子面前的桌子上，问孩 子“多少块?”要他“数一数”。向他说 明数积木的时候要指着每一块积木(用 “手指头数这些积木”或“指着积木数”)。 如果孩子能数出2块，然后再加5块放在 孩子面前，重复同样实施。注意孩子是否 逐块地数积木。","12块小积木， 放在一个盒子 里（但 只 使用颜色相同 的积木）","","是","2","P","在两次试数中，孩子均能正确地数出积木数。","1","E","孩子仅能正确地数2块积木；或未能设法数对(例如不止 一次指着同一个积木或跳过去一块积木等)。","0","F","孩子不能或者也不试着去数。","","","","","",""
"49","发展","认知表现","49D：接受性地辨认2块及6块积木","至少把8块积木放在孩子面前。要他给你 2块积木，把这2块放回到桌上，然后要 孩子递给你6块积木。","12块小积木， 放在一个盒子 里","","是","2","P","孩子能正确地递给你2块及6块积木。","1","E","孩子能正确地递给你2块积木或者递给你6块积木。","0","F","孩子不能正确地递给你2块或6块积木；或者他也不试着 去这样做。","","","","","",""
"50","发展","认知表现","50：独行两步指令“把一块积木放进杯子，再把杯子放在地板上，""","把一些积木放在桌子上，边上再放一只杯 子、引起孩子的注意，然后对他说：“把 一块积木放进杯子，再把杯子放在地板 上：”经过相当时间之后，如果孩子仍难 于理解，则重复一追指令。可是一旦孩子 已开始去做，就不要进一步给他任何口语 或非口语的提示。","一个杯子，多块 积木","","是","2","P","孩子能正确执行这两个指令，","1","E","孩子没能成功地执行这两个指令(例如仅把积木放进杯子 里：或者先把杯子放到地板上，然后再放积术块：或在杯 子里放进不止一块积木块)。","0","F","孩子不能或者也不试着去执行任何一个指令。","","","","","",""
"51","发展","口语认知","51：唱数1 — 10","让孩子大声数数。如果孩子似乎难于理解 这项任务，就帮助他，说“1,下一个是 几 ? ”","无","","是","2","P","孩子能正确地从1数到10。","1","E","孩子能正确地至少数到3。","0","F","孩子不能正确地至少数到3,或也不试着去数。","","","","","",""
"52","发展","口语认知","52：表达性地辨认1—10 数字","随意选择一张数卡。拿起卡片靠近孩子， 问他“这是几?”在相当一段时间之后， 如果孩子没有回答，你来辨认第一个数 字。然后对剩余的卡片重复同样实施步 骤。","10张卡片上面 分别写有1-10 的10个数字","","是","2","P","孩子能正确辨认所有10个数字。","1","E","孩子能正确辨认至少一个数字或者他把所有10张卡片(的 数字)都说成同一个数字(如把卡片上的数都说成是“5”)。","0","F","孩子不能正确辨认任何一个数字；或者他也不试着去这样 做。","","","","","",""
"53","发展","口语认知","53A：心算加法和减法题","引起孩子注意。把下面的3道题读给他 听，每次一道题。在每读一道题时，要允 许有足够的时间供孩子去解题和回答。这 些题可以读一遍以上。 a)假如你有一个球，我再给你两个球， 你一共有几个球?(3个) b)假如你有两个硬币，我再给你四个 硬币，你一共有多少硬币?(6个) c)假如你有五个娃娃，送掉两个，你 还剩几个?(3个) 注：如果49C(数出2及7块积木)记 分为F,那么53A、53B都记为F。","无","","是","2","P","孩子能正确地答出至少两道题。","1","E","孩子能正确地答出其中一道题。","0","F","孩子不能正确地算出任何一道题；或者也不试着去做。","","","","","",""
"53","发展","口语认知","53B：心算出加法和减法题","此项实施步骤同53 A。 读出如下问题： a)小刚有五个球，送掉两个，他还剩 下几个?(3个) b)佳佳有两个硬币，他妈妈又给他四 个硬币，他一共有多少?(6个) c)南南有三个娃娃，她爸爸又给了她 一个，她一共有多少个?(4个)","无","","是","2","P","孩子能正确地答出至少两道题。","1","E","孩子能正确地答出其中一道题。","0","F","孩子不能正确地算出任何一道题；或者他也不试着去做。","","","","","",""
"54","病理学","物品喜好","54A：对线绳做出不适当反应","先把线绳放在孩子面前的桌子上。然后你 开始从盒子里慢慢拿出珠子，放到你的衣 兜里。这时，你要注意观察孩子如何对线 绳做出反应。","一盒大珠子，一 条末端打了结 的粗线绳","","是","2","A","孩子能对线绳做出适当反应(如：问绳子是干什么用的， 拿起线绳好像要预备穿珠子等)。","1","M","孩子对线绳毫无兴趣或有点使用不当。","0","S","孩子对线绳做出不适当反应(如以一种古怪的方式使用绳 子：嚼它、用它勒脖子、盯着它看或者反复地玩弄线绳)。","","","","","",""
"54","发展","精细动作","54B：穿珠子","把两颗珠子放在孩子面前的桌子上。向他 说明去穿珠子。在相当一段时间之后，如 果孩子对理解或完成这一项目仍有困难， 就示范给他看。然后再次向他说明把珠子 穿起来。","一盒大珠子，一 条末端打了结 的粗线绳","","是","2","P","孩子没有太大的困难就能穿上至少一颗珠子。","1","E","孩子至少穿上了一颗珠子，但有相当大的困难；或者他虽 然未能设法穿上一颗，不过他似乎知道必要的动作。","0","F","孩子未能设法穿上珠子，且似乎也不知道必要的动作，或 者他也不试着去这样做。","","","","","",""
"54","发展","粗大动作","54C：像钟摆一样摆动穿在线绳上的两颗珠子","把两颗珠子穿在线绳上。站起来并向孩子 说明和你一样站起来。然后举起线绳示范 如何像钟摆那样往复摆动珠子。把线绳递 给孩子，向他说明也这样做。","一盒大珠子，一 条末端打了结 的粗线绳","","是","2","P","孩子能像钟摆一样往复摆动珠子。","1","E","孩子未能设法往复摆动珠子(例如：上下抖动绳子，或者 以短促急拉的动作来晃动)。","0","F","孩子不试图以任何方式来摆动珠子。","","","","","",""
"55","发展","精细动作","55：双手并用","在孩子穿珠子、剪纸、或上颜色的过程中； 或在正常情况下需用双手来完成的任何 其他项任务的过程中，观察孩子。注意孩 子是否能同时协调一致地使用双手(如用 一只手拿绳子，另一只手拿珠子；或者一 只手上颜色，而用另外一只手拿纸等)。","无","","是","2","P","孩子能一贯地很协调地同时使用双手。","1","E","孩子不能一贯协调地使用双手(如知道必要的动作，但有 时弄混淆了；协调不好等)。","0","F","孩子不能或者也不试着去协调地使用双手。","","","","","",""
"56","发展","粗大动作","56：把物品从一只手转移到另一只手","在拼图或穿珠子等项目的过程中观察孩 子。注意孩子是否能自由地把物品从一只 手转到另一只手上。","无","","是","2","P","孩子能毫无困难地把物品从一只手随心所欲地转移到另一 只手上。","1","E","孩子不能一贯地把物品从一只手转移到另一只手上，并且 这样做时往往有相当大的困难。","0","F","孩子不能或也不试着去把物品从一只手转移到另一只手上。","","","","","",""
"57","发展","精细动作","57：用大拇指及食指握成钳形来夹取一粒M&M巧克力","把一粒M&M巧克力放在你的手掌里，稍 稍握紧这只手。把握有巧克力的手伸向孩 子，注意他是如何拿出糖粒的。","一 粒 M & M 巧 克力","","是","2","P","孩子能仅用大拇指和食指(像精巧的钳子似的)准确地夹 取糖粒。","1","E","孩子能拿到糖粒，但用了大拇指和两个或两个以上的手指 (像较差的钳子)来得到它。","0","F","孩子不能或者也不试着用拇指和食指去夹取，也不会用拇 指和几个手指去抓取糖粒(如用手掌去得到它)。","","","","","",""
"58","发展","知觉","58：找到藏在杯子下的 M & M 巧克力","在桌子上把3个杯子摆成一排，并引起孩 子的注意。把巧克力放在中间杯子下，缓 慢地把中间的杯子与你右手的杯子变换 位置，向孩子说明去找到糖粒。如果孩子 难于理解或完成这项任务，则把右手的 杯子拿起来给他看糖粒。然后把糖粒放在 中间的杯子下面，重复同样实施。把糖粒 藏在你左手的杯子下，然后缓慢地与中间 的杯子交换位置，向孩子说明去找到糖 粒。把糖粒藏在右手杯子下，然后与左手 杯子交换位置，向孩子说明去找到糖粒。","3个杯子和1粒 M & M 巧 克 力","","是","2","P","在3次试验中，孩子至少能找到糖粒两次。","1","E","孩子在3次试验中有一次找到了糖粒。","0","F","孩子不能或不试图在任何一次试验中去找到糖粒。","","","","","",""
"59","发展","认知表现","59：用手势表达5种物品的用途","随意选出一张卡片给孩子看，向他说明要 用手势去表达如何使用它(“做给我看， 你用它做什么”)。如果孩子似乎难于理解 这一任务，拿第一张卡片示范给他看。对 其他几张卡片以相同的步骤重复实施。","5张卡片，分别 画有下列图画： 哨子、球、鼓、 钥匙和锯","","是","2","P","孩子能用手势表达出所有5种物品的用途。","1","E","孩子至少能用手势表达一种物品的用途；或者他能描述至 少一种物品的功能，但没有用手势。","0","F","孩子不能或也不试着用手势去表达任何一种物品的用途； 或者他也不去描述它。","","","","","",""
"60","发展","知觉","60：听见并寻找手摇铃声音的方位","当孩子从事另一项活动时，藏起手摇铃。 然后用力摇动，并注意孩子的反应。","一个手摇铃","","是","2","P","孩子能明显地对声音做出反应，并正确辨认声音的方向。 这种反应可以是语言的(如问这是什么声音)或非语言的 (如眨眼，改变面部表情，吃一惊等，并把头转向声音的 方向)。","1","E","孩子有听到声音的某种表示，但不能辨认声音方向或辨认 声音方向不正确。","0","F","孩子绝对没有语言或非语言的表示，说明他听到了声音。","","","","","",""
"60","病理学","感觉模式","60：听见并寻找手摇铃声音的方位","当孩子从事另一项活动时，藏起手摇铃。 然后用力摇动，并注意孩子的反应。","一个手摇铃","","是","2","A","孩子能对声音做出适当反应(见上面)。","1","M","孩子在相当长时间迟疑之后能做出反应或显示出轻度的不 适当的情感反应。","0","S","孩子对声音做出不适当的反应。他的反应也许是过分的情 感反应(如极度害怕，或长时间尖叫),过度敏感(如捂上 耳朵),或很不敏感(如无任何反应)。","","","","","",""
"61","发展","认知表现","61：依据颜色或形状把 12张卡片分类成组","把12张卡片随意堆放在桌子上。向孩子 说明把它们分成组(“把同样的指给我 看”,“把它们匹配起来”或“把它们分成 组”)。一段时间之后，如果孩子仍难于理 解或完成这一项目，就拿一组做示范(如 三角形或绿色的)。然后再次要他去归类 卡片。必要时你可以进一步示范把所有卡 片归类。然后把卡片混在一起，随意放在 桌上，并再次要孩子试着完成这项任务。","卡片12张，分 别由4种形状 (菱形、圆形、 正方形和三角 形)及3种颜色 (绿、红、紫色) 组合而成。","","是","2","P","孩子不需要充分示范就能把所有卡片分成组(颜色或形状)。","1","E","孩子能完全或部分地把卡片至少分成一个组(如所有绿色 的或者两个三角形);或者需要充分示范才试图去做或完成 该项任务。","0","F","孩子甚至在充分示范之后仍不能部分地将任何卡片分类； 或者也不试着这样做。","","","","","",""
"62","发展","认知表现","62：预想常规的做法","在测试过程中，每当一项任务完成时，就 把该项所用过的器材归入塑料整理箱中。 鼓励孩子来帮助这样做。观察孩子是否能 理解这一常规，不经提示是否也能这样 做。","盛测试器材用 的塑料整理箱","","是","2","P","孩子能迅速建立起惯常做法的概念，仅需稍加提示就知道 下一步该做什么。","1","E","要到测试快结束时才能理解，或需要较多的提示。","0","F","没有下一步该做什么的概念，或对常规的做法完全不理解。","","","","","",""
"63","发展","知觉","63A：对图册显示兴趣","把语言读本放在孩子面前的桌子上。一段 时间之后，如果他还没有去打开，就鼓励 他去打开(如问他是否会看书或者问他是 否知道这是什么东西等)。注意孩子是如 何察看这本图片册的。","语言读本图册","","是","2","P","孩子能察看图册并显示出对图片的某种兴趣(例如：打开 图片册，一页一页翻过去，并肯定在注视图片)。","1","E","孩子能察看书本，但对图片并没有表现出明显的兴趣(例 如打开图片册，稍微浏览一下，并不肯定在注视图片；一 次翻过去4页等)。","0","F","孩子甚至经反复鼓励也不去打开图片册。","","","","","",""
"63","发展","认知表现","63B：接受性地辨认语言读本中的图片","把语言读本放在孩子面前，图片要对着 他。翻到第一页，并引起他的注意。然后 问他“哪个是杯子?”,“杯子在哪?”等， 要他去触摸或者指认给你看“杯子”。如 此逐页重复同样实施。用来问孩子的词 语见“语言读本63B项指导语”。 (注意记录孩子的各种实际的反应，这些 反应将可用于促进语言训练计划的编 制。)记下答对的数目。如果孩子连续说 错了5个，就停下来。","语言读本图册","","是","2","P","孩子至少能正确辨认出14张图片， E:孩子能正确辨认出至少一张图片。 F:孩子不能正确辨认出任何一张图片，或者他也不试着去这 样做。","1","E","孩子能正确辨认出至少一张图片。","0","F","孩子不能正确辨认出任何一张图片，或者他也不试着去这 样做。","","","","","",""
"63","发展","口语认知","63C：表达性辨认语言读本上的图片","打开语言读本。指着奶牛问孩子“这是什 么?”如果语词是一个动词，就问“他(她) 在做什么?”对其余的词重复同样实施。 记下正确回答的数目。当孩子5次失误或 者连续回答不出5张图片时就停下来。","语言读本图册","","是","2","P","孩子至少能正确辨认其中14幅图片。","1","E","孩子至少能正确辨认其中一幅图片。","0","F","孩子不能正确地辨认任何一张图片，或者也不试着这样做。","","","","","",""
"64","发展","模仿","64：口头模仿声音","引起孩子注意，向他说明去重复你所说的 内容(“仔细听”或“照我说的去说”)。 然后说“Mmm”,并向他说明去复述。对 ba-ba,pa-ta,la-la这些声音依照同样的 步骤实施。如果孩子好象有困难，可以增 加一个练习项目(如da-da)。","无","","是","2","P","孩子至少能正确模仿三种声音。","1","E","孩子至少能正确模仿一种声音；或者他设法去模仿，但未 能发出准确的声音(如言语障碍，或者不成熟的构音等)。","0","F","孩子不能或者也不试着去模仿任何一种声音。","","","","","",""
"65","发展","模仿","65：模仿单词","引起孩子注意，然后照64项那样实施。 要孩子去说如下这些单词： 1)“向上”; 2)“做饭”; 3)“宝宝”。","无","","是","2","P","孩子至少能正确复述其中两个单词。","1","E","孩子能正确复述一个单词；或者某个单词的一部分(如说 “向上”,或者说了“宝”表示“宝宝”)。","0","F","孩子连某个单词的一部分也不能复述或者他也不试着去这 样做。","","","","","",""
"66","发展","口语认知","66：模仿短语","引起孩子的注意，如64项一样实施。要 孩子复述这些短语： 1)“宝宝向上看”; 2)“我要纸”; 3)“他不哭”。 注：如果65(单词模仿)记分F,那么 66也记分F。 词语应当以每秒两个字的速率说出。","无","","是","2","P","孩子能正确地复述至少两个短语。","1","E","孩子能正确地复述至少一个短语或者只重复其中一个短语 中的两个词(如“宝宝看”,“要纸”及“他哭”等)。","0","F","孩子连任何一个短语中的两个词也不能复述；或者他也不 试着这样做。","","","","","",""
"67","发展","口语认知","67：模仿简单句","引起孩子注意，如64项同样实施。要孩 子复述下列句子： 1)“宝宝敲打一个红色的球。” 2)“我看见飞机在空中飞。” 3)“康康买了一个娃娃和一辆车”。 注：如果66(短语模仿)记分F,那么 67也记分F。 词语应当以每秒两个字的速率说出。","无","","是","2","P","孩子能正确复述出3句中的两句话。如果他说错了某一个 词，而这个词的发音与你实际说的非常相似，也可按通过 评分。","1","E","孩子至少能复述出其中一句话；或者不管顺序是否正确， 他能复述其中一句话中的4个词(如“看见飞机空中飞”, “康康和一辆车”等)。","0","F","孩子连任何一句话中的4个词也不能复述或者他也不试着 这样做。","","","","","",""
"68","发展","口语认知","68：模仿复合句","引起孩子注意，如64项同样实施。要孩 子复述下列句子： 1)“虽然我的狗汪汪叫，但猫却没有跑。” 2)“在吃饭之前，我总是先洗手。” 3)“要是你坐好了，就给你一本书。” 注：如果67(模仿简单句)记分F,那么 68也记分F。","无","","是","2","P","孩子能正确复述3句话中的两句。","1","E","孩子至少能正确复述其中一句：或者他至少能复述三个句 子中的两个分句(如“要是你坐好了”和“但猫却没有跑” 等 )","0","F","孩子不能正确复述三个句子中的至少两个分句：或者他也 不试着这样做。","","","","","",""
"69","发展","认知表现","69：对口头指令做出反应","把这些物品放在孩子面前的桌子上，并引 起孩子的注意。然后说出下列指令，并 向他说明去做你让他做的事(“照我说的 去做”)。 1)敲打盒子。 2)拍拍小狗。 3)站起来跳一下。 4)把杯子放到盒子里，然后坐下。 5)敲敲门，再摸摸墙。","一个球，一个杯 子，一只手偶 狗，一个装得下 一个杯子的盒 子","","是","2","P","孩子至少能执行4个指令。","1","E","孩子至少能执行一个指令；或者仅仅部分地执行一个指令 (如把杯子放进盒子，摸一下墙等)。","0","F","孩子不能至少部分地执行任何一个指令，或者也不试着去 做。","","","","","",""
