排序,分组,领域,评估项目,操作描述,所需材料,适用年龄,是否必答,评分说明_2_通过,评分说明_1_萌芽,评分说明_0_不通过
115,行为表现,人际关系,不知道测试者的存在,注意孩子是否似乎知道测试者的存在。他对测试者的声音能否有反应，有无视线接触，对表扬与微．笑有无反应。,,,是,孩子能对测试者作出反应，即对测试者的声音能作山反应，能看着他，对他的微笑或表扬做出反应等,孩子显示出在某种程度上缺乏社会性反应，包括缺乏视线接触，或者很少主动开始互动行为，通常需要介入才能引起社会性反应,孩子似乎不知道测试者的存在。也就是说，孩子很少对他作出反应，相当孤独，或者忘记测试者的存在。测试者必须总是强行介入才能引起任何反应
116,行为表现,人际关系,与测试者不合作,注意孩子是否对测试者的要求采取合作态度。,,,是,孩子除了在似乎不理解或在不知道如何去做要求他做的事以外，通常都能按测试者的要求去做,孩子持轻度的抗拒态度。合作是不稳定的或者多变的,孩子持极度抗拒态度，或者其合作极度不稳定或多变，几乎不想与测试者合作
117,行为表现,游戏及对物的兴趣,集中注意力的时间不正常,注意就其年龄来说，孩子是否对测试者、测试材料或要求做的任务给予足够的注意．还要观察当测试者要求他注意时，他是否变得灰心丧气。,,,是,孩子集中注意力的时间在正常范围内．要认识到年龄较小的孩子与年龄较大的孩子相比，其注意力集中的时间要短些,象一个比他幼小的孩子一样，他的注意力集中的时间比较有限,孩子的注意力转瞬即逝，他不能与测试者合作；或者不能完成简单的任务：或者当测试者要他注意，或者某项任务要求他在某种程度上集中注意力时，他很容易分散精力或者变得极度灰心丧气
118,行为表现,感情,不能容忍被打断,当你拿走一种他似乎喜欢的测试材料，或从一项测试转到下一项时，注意孩子如何反应。,,,是,孩子能容忍从一项测试转到另一项，而且当拿走他所喜欢的测试材料时，并不特别不高兴,孩子对转移测试项目或是拿走测试材料有相当的困难，但他还能做到去完成下一个项目,孩子不能容忍被打断．即当告诉他把一件喜爱的物品收拾起来或转换另一测试项目时，孩子有一种极端的情感反应．病理学行为可能包括：过度的哭喊、尖叫、两手扑动、做鬼脸、发脾气、撞头等
119,行为表现,语言,不正常的语调及音调变化,注意孩子(两岁以上)的言语模式及语调是否异常．,,,是,孩子的语调在正常范围内，有抑扬顿挫，音量及速度合理,言语的特点是：音调及音高几乎没有变化，音量异常，语速有点慢，有点快或不均匀,孩子言语显著不正常，包括怪异的语调及音调，言语质量呆板机械，以及类似唱歌，发声嘶哑或尖厉
120,行为表现,语言,发出无意义的声音(如婴儿咿哑学声语),注意孩子(超过1岁半)是否反复发出毫无意义或令人难以理解的声音。,,,是,从不发出无意义的声音,孩子偶而发出无意义的声音(年龄在1岁半以—1),经常发出无意义的声音，并且好象是婴儿咿哑学语
121,行为表现,语言,不适当地使用词语,注意孩子如何使用单词及短语，孩子的言语是不是有一定意义．,,,是,孩子使用的词语与情景及年龄相适应，具有功能性，口语交际能力,孩子使用词语的水平有些迟滞．也可包括偶而有不适当的言语,孩子不使用任何词语进行交际，或者他总的来说使用词语不当．病理学行为可包括：在表达需求时词不达意：重复电视广告中的短语或有韵律的句子；或持续使用不适当的词语来描述环境或物品(例如，把所有玩具都叫做“玉米片”)
122,行为表现,语言,使用怪癖的或自创的特异话语,,,,是,孩子能使用正常的、与情景相联系的词语,孩子偶而使用无意义的词及短语。同时孩子也能使用一些具有交际功能的词语,孩子经常说些怪癖的话语(莫明其妙的词或短语)，或者特异的语言，如，生造出来的或隐喻的词语(用“把灯关上”表示“我要自己呆一会儿”)
123,行为表现,语言,即时式反响语言,,,,是,孩子不会去不适当地重复刚才听到的话,在不该重复词语的场合，孩子偶而重复他刚才听到的话,孩子经常无意义地重复他刚才听到的话
124,行为表现,语言,延迟式反响语言,,,,是,除非有必要，孩子不会不适当地重复他在一段时间之前听到过的话,在不该重复词语的场合，孩子会偶而重复他在一段时间之前听到过的词语,孩子经常不适当地重复在一段时间之前听到过的词语
125,行为表现,语言,词或声音的持续反复,,,,是,孩子不会一遍又一远地持续重复词语或声音(没有持续言语症),孩子偶而持续某些词语或声音,孩子经常持续某些词语或声音
126,行为表现,语言,代词倒转,,,,是,孩子能正确使用代词,孩子偶而混淆“你”，“我”、“他／她”。这些代词(年龄在两岁半或两岁半以上时)，或在谈到自己时用自己的名字而不用“我”,孩子经常代词倒转而且似乎不理解。“我”和“你”(年龄在两岁半或两岁半以上时)
127,行为表现,语言,不能自发进行语言交流,孩子交际用语言是否符合功能，是否相互关联?是否不能或不愿提问或回答问题?其交流的内容是否缺少多样化和自发性?有没有自发语言。,,,是,孩子(一岁半以上)能运用多样化的功能语言和自发语言作出反应，交流思想或提出问题,孩子很少进行自发交流或相互交流，仿佛很害羞，但能在受到鼓励的情况下在有限的程度上作出反应,孩子不能运用任何自发的、功能性的、有关联的沟通手段，或以重复的或不恰当的方式反复讲一个主题
128,行为表现,语言,言语不可理解,孩子是否由于发音不清晰、发音方法有问题或语音混淆等引起言语无法理解。,,,是,孩子发音清晰，容易理解，声音不会混淆,孩子由于发音不清晰，发音方法或声音混淆使言语有点令人难以理解(两岁以上),孩子由于发音不清晰，发音方法不当造成声音混淆，言语无法理解
129,行为表现,语言,句法规则混淆,,,,是,孩子能擦正确顺序使用词语(两岁半以上孩子)。就孩子年龄来说，词序有点混淆但在正常范围之内,孩子偶而在短语或句子中混淆词序。混淆的情况有点超出孩子的年龄范围,孩了在短语或句子中经常出现词序错乱现象
